{
  "schema_version": "0.3.0",
  "graph_id": "qgraph-decomposition-001",
  "created_at": "2026-10-16T01:40:00Z",

  "graph_status": "stable",

  "nodes": [
    "q-trip-001",
    "q-transport-001",
    "q-hotel-001",
    "q-budget-001"
  ],

  "edges": [
    {
      "edge_id": "qe-trip-001",
      "from_question_id": "q-trip-001",
      "to_question_id": "q-transport-001",
      "relation": "decomposed_into"
    },
    {
      "edge_id": "qe-trip-002",
      "from_question_id": "q-trip-001",
      "to_question_id": "q-hotel-001",
      "relation": "decomposed_into"
    },
    {
      "edge_id": "qe-trip-003",
      "from_question_id": "q-trip-001",
      "to_question_id": "q-budget-001",
      "relation": "decomposed_into"
    }
  ]
}
